{
  "date": "2026-06-14",
  "summary": "沪深300呈现显著结构性分化：半导体涨价周期与AI算力需求共振推动士兰微、生益科技等涨停，新能源（光伏+锂电+储能）受业绩预增与政策利好驱动强势领涨，亿纬锂能上半年业绩预增95%-110%带动锂电板块走强；跌幅端集中在化工、消费、地产及能源板块，新奥股份私有化告吹引发失望性抛售，维生素涨价潮后新和成高位回调，煤炭受监管收严拖累整体走低。",
  "gainers_analysis": {
    "sector_summary": "半导体涨价周期与AI算力需求共振，新能源（光伏+储能+锂电）受政策利好与业绩预增驱动，稀土板块受益于涨价预期，整体呈现科技成长风格占优",
    "stocks": [
      {
        "code": "300014",
        "name": "亿纬锂能",
        "reason": "上半年净利润预增95%-110%超市场预期，叠加二次递表港交所催化",
        "evidence": [
          {
            "title": "千亿锂电龙头，300014，上半年业绩预增95%至110%",
            "url": "https://news.google.com/rss/articles/CBMijgFBVV95cUxPSDRaWmRYY1VmUmozMnVZc3RRZklFcGlfeGxaNGpsVUlUcDliOTluZmVJVzZuT1FaT0RXV2FxOS1IRExYWUNIaTlIY0ozb0I3aGFqbHVibGw1TUtGUV9MUEFLYnJHT0xsNzVacWY4VWxYbEFFamVjQ0tDb3BBU1VLLUpBQlFKb0hOUzN2eEt3?oc=5",
            "pub_date": "2026-06-15 13:36"
          },
          {
            "title": "亿纬锂能上半年净利润预计增长95.00%~110.00%",
            "url": "https://news.google.com/rss/articles/CBMiTkFVX3lxTFBvU3p1dnY0N25ZeEk2YW9vTzU3STBiTzVVeXJodVN4R0MzbF8wVW9MejUwS2E4X2xpM0Z5eV9JY0lIdDZxSzRzUEowNFhSZw?oc=5",
            "pub_date": "2026-06-15 13:13"
          },
          {
            "title": "新股消息 | 亿纬锂能(300014.SZ)二次递表港交所",
            "url": "https://news.google.com/rss/articles/CBMibEFVX3lxTE05NmlsakRJcjhKakc0MExud1l4dG5jQVZvV1pIQmR6azB5WmR3V2QwQzQyXzBxQnZsUTB2TnBSVndmdkFWdldWV21xM3BQZDVacnd4UUxYaVNiSzB5RXJiSllvMDU2X2xkYW12VA?oc=5",
            "pub_date": "2026-01-04 08:00"
          },
          {
            "title": "亿纬锂能一日连推两储能项目 拟总投资110亿元新增110GWh产能",
            "url": "https://news.google.com/rss/articles/CBMibkFVX3lxTE94cEEtbmhXV0hPZWU0QldpSVlTWEFLc0hqM1BqMGV2QmZycXNEdDR5dUlTdk5aeS1PcW41ZXBrcVNGbW5td00zcDB6SHoxVlMxUGJiMlBpcV9kcmtucDZuOHJlb2dfR3Z3eklRMDdn?oc=5",
            "pub_date": "2026-04-07 07:00"
          }
        ]
      },
      {
        "code": "600460",
        "name": "士兰微",
        "reason": "半导体涨价传导至终端市场，AI算力需求升温叠加AI终端分级国标落地利好",
        "evidence": [
          {
            "title": "半导体涨价攻入终端：手机率先调价，家电汽车亦承压",
            "url": "https://news.google.com/rss/articles/CBMijwFBVV95cUxPRzUySjF1NEZQWkFtLUZYTHFHZWhGV2tKbUd1ME1hUHR5eVQxcmxyNHNxOWdwTlRESHFWUEl3UE53YlJ1anJFOUhOMHpTd2VrSWRsSjFOTjZ4TWZ4QjZtMG9fUDZlLUhaYnBlUG5RZncwVTJqekxKYUxpakVsakZzb3hpQXEwc2ZyVDJxU2o1NA?oc=5",
            "pub_date": "2026-03-17 07:00"
          },
          {
            "title": "AI算力需求升温，芯片ETF易方达涨1.40%",
            "url": "https://news.google.com/rss/articles/CBMiVkFVX3lxTE15REloTHdQRGg3VFpsV0doekJjcFU4SVh6NE11SV95d2t2M0NJSjhPb1NyTnNSQ05xbTNIcDZJVG1LQm50aFVtT0xFaEFNN3hUUWVpTWlR?oc=5",
            "pub_date": "2026-05-25 07:00"
          },
          {
            "title": "AI终端分级国标落地，消费电子ETF易方达涨1.40%",
            "url": "https://news.google.com/rss/articles/CBMiVkFVX3lxTE5DVkRjaG13TlVuXzVHXzlZeHJpNlM1S2VLSVpndHBLWWVqMFIwQmxiTEJvaTJMWkJJVElNR2tMUmxmWUhFS1QwUVVsdjFSWmFVbE5aVlln?oc=5",
            "pub_date": "2026-05-27 07:00"
          }
        ]
      },
      {
        "code": "603290",
        "name": "XD斯达半",
        "reason": "半导体板块整体走强，IGBT龙头受益于国产替代与涨价周期",
        "evidence": []
      },
      {
        "code": "300763",
        "name": "锦浪科技",
        "reason": "光伏产业迎政策利好，绿电直连政策推动逆变器需求回暖",
        "evidence": [
          {
            "title": "光伏产业迎政策利好，光伏ETF易方达涨3.34%",
            "url": "https://news.google.com/rss/articles/CBMiVkFVX3lxTE1UTHRFRlB3MHhITHIyRzF1eUQteDU1MG5XQi0zaFJIZi1Jek5WV2trdllZQjUxVGNMSXd2dkgxRzVzMWxxdUtIUE00WHY4ZXNSSzZWNXp3?oc=5",
            "pub_date": "2026-05-27 02:17"
          }
        ]
      },
      {
        "code": "600183",
        "name": "生益科技",
        "reason": "AI服务器升级打开PCB产业空间，MLCC/PCB板块领涨推动涨停",
        "evidence": [
          {
            "title": "异动快报：生益科技（600183）6月15日10点1分触及涨停板",
            "url": "https://news.google.com/rss/articles/CBMia0FVX3lxTE96Nmk4ZDY4bUo5ZGgxZlJKbVgzV1RCSmNabHlNVnJfMzduY1dPSWxHTm04dXZZY1pqYUZiLVdQdmFva1hwSFFZSnJxWnN5MDVpRFFNNVNUbEhZMEtlVU5NazU5d1Z3aElRU2dR?oc=5",
            "pub_date": "2026-06-15 02:15"
          },
          {
            "title": "AI服务器升级打开产业空间 A股PCB概念股强势 生益电子、生益科技等多股涨停",
            "url": "https://news.google.com/rss/articles/CBMiiAFBVV95cUxQU19nVTRFVFBzVGF6Z1ZwcXRIR2NDMzdlNmR2WHNPQXVfMWV3WV94VV96a1JVS3pLakZJZ2YzaExvTURoMW1fZTZjdzVkOXBKOHkwVXNfWFk1eGZ1eS1TNTJTcUp2ajNjdk82VEdtMV92UVNPYXBFN2IzTGNhYmhNakd1QVdWeE1h?oc=5",
            "pub_date": "2026-05-26 07:00"
          },
          {
            "title": "A股收评：深成指、创业板指涨超3%！沪指收复4000点，MLCC、PCB板块领涨",
            "url": "https://news.google.com/rss/articles/CBMib0FVX3lxTE56ZUk1R2JCSWJIUHJ3a054QkNSU0NmODYxOGpqbGpWLVJ5MlJLcGdwZHI2ZENtN3A4WW9tQ1dXMGVzdmJpZ2NoS3BGMkoxUndEOHRCY0NrRlNXc1hMUVV5Ykc4bmtYMk5aSGtLWkE5QQ?oc=5",
            "pub_date": "2026-06-09 07:23"
          }
        ]
      },
      {
        "code": "300433",
        "name": "蓝思科技",
        "reason": "iPhone18带来果链量价齐升新周期，并购巨腾国际拓展AI硬件版图",
        "evidence": [
          {
            "title": "iPhone18 带来A股果链量价齐升新周期，但这一次红利不会平均分配",
            "url": "https://news.google.com/rss/articles/CBMia0FVX3lxTE5rUVdVcC1mYXJocEdyTlpKQUxWWHZ3eFlpWk1BeS1JbDFuRzlFbUY0SDB5Qmp0dUEyQUFmN1V6bWNDSEdWQnBPNkRDeWdtNHluZE52WjFmeEdTbHcyVDFFQkJJUklnRDNnUWtN?oc=5",
            "pub_date": "2026-06-10 15:00"
          },
          {
            "title": "蓝思科技（06613.HK）并购巨腾国际，AI硬件野心浮现",
            "url": "https://news.google.com/rss/articles/CBMiWkFVX3lxTE9aZnBoSzJaeVNkUXR4VXJtekFvMENVNi1LNHJENDl5ZmN6UzlrUGljc09YVGppZXJIYjM1RHROT01TaUFwX2ZMNE1jQnFPNXJOakJyWnBvdHRVdw?oc=5",
            "pub_date": "2026-05-18 07:00"
          }
        ]
      },
      {
        "code": "000733",
        "name": "振华科技",
        "reason": "MLCC、超级电容板块逆势走高，军工电子需求稳健叠加主力资金博弈",
        "evidence": [
          {
            "title": "振华科技（000733）6月12日主力资金净卖出2.55亿元",
            "url": "https://news.google.com/rss/articles/CBMia0FVX3lxTE5LZFhCRHR6ZTB2TllBZ01kU1paMndNVjhVVk9KOVhNZVh6c1A4V0l2cVgwVVV3UDB3bUFyYU9oTHlzV0c0WVFHOFZET2hTVElfbjdtbmNMYjdtbUZDc2pzX3picVBpREJVR1VF?oc=5",
            "pub_date": "2026-06-15 01:24"
          },
          {
            "title": "A股收评：缩量下跌！MLCC、工业气体及存储芯片股逆市走高",
            "url": "https://news.google.com/rss/articles/CBMib0FVX3lxTE1CX2dwc2pEMWJOOFZGa0M2d2pHOXotWXM0MHZKRHVXd0gwZmNOYlpwRDF0SjF0bTBQWk43OXhYdjExTGVPLVMwcVBaN2pKZDZLZUhETW5Ra1pQRnlXdXZsc29yTjg5bW44SGhVbFF0dw?oc=5",
            "pub_date": "2026-06-04 07:39"
          }
        ]
      },
      {
        "code": "600176",
        "name": "中国巨石",
        "reason": "电子布再度提价，玻纤概念集体走高，资金净流入居前",
        "evidence": [
          {
            "title": "盘中必读|电子布再度提价！玻纤概念集体走高，国际复材20CM涨停",
            "url": "https://news.google.com/rss/articles/CBMiWEFVX3lxTE9IbFVfMHZmTXdMZ2lwRnZudFJfVjBDQUYtLTdvM200QXViVDM4dGNuRmlubi1RNEZWLUJ4V3k0d0ZqOGxIMGFJOWtNMnllS0FfdlA1UjFlcG0?oc=5",
            "pub_date": "2026-02-10 08:00"
          },
          {
            "title": "潜龙浮出水面：06.09收盘主力：资金净流入前20股票",
            "url": "https://news.google.com/rss/articles/CBMia0FVX3lxTE5vdzNBb0ZzMk53YVNfQ0lmTFhjbGRncmxLYnFjRkNmSFd0MDk4OXhIYzlKTHBvaGM4YXNZX184N3JUbk42cUdXYjZXMkZtNEU4S09hTFllejlXSXVnUVVOclpjNWRubXNoaWxz?oc=5",
            "pub_date": "2026-06-09 17:00"
          }
        ]
      },
      {
        "code": "300751",
        "name": "迈为股份",
        "reason": "光伏概念股集体上涨，太空光伏概念催化HJT设备龙头估值",
        "evidence": [
          {
            "title": "A股光伏概念股集体上涨，迈为股份大涨超11%，TCL中环10CM涨停",
            "url": "https://news.google.com/rss/articles/CBMihwFBVV95cUxNdU5wdnl3ZmhFcGdQdzgyRzI3UVVwb3BidnBSZGZPVEJQZEhQVEFwSjJudXJEUjh4RU8wUm03RmFraElIOFdJZzhQQXJjczh2d0NGVmhJM0pLY1lfTTFTVXBMQWYyLXdwbmFWcVh3UWNETl95Nzlpb0E5WThHaFVERGpndmRqYkE?oc=5",
            "pub_date": "2026-06-12 01:40"
          },
          {
            "title": "两月股价增两倍，太空光伏点燃迈为股份千亿市值",
            "url": "https://news.google.com/rss/articles/CBMiWEFVX3lxTE9vNFdScm5MY3NWdEtrTzI2aG1LMDBhTWFpNHI0bzRjZTh2eXE1MmdSb0tEMlBtRGtpVFN5Ri1ESjlOUUlVeW4xS2ZPUF9nQUlfck56c0lLcFI?oc=5",
            "pub_date": "2026-01-26 08:00"
          }
        ]
      },
      {
        "code": "688396",
        "name": "华润微",
        "reason": "一季报净利润同比增296.56%超预期，半导体涨价周期受益显著",
        "evidence": [
          {
            "title": "华润微(688396.SH)：2026年一季报净利润为3.30亿元、同比较去年同期上涨296.56%",
            "url": "https://news.google.com/rss/articles/CBMihwFBVV95cUxPNk5xT0JsM1VyWEJQMTNZbmhQdVI4T0JoLWt0b0J4azBicFhrRjUzYU9hMXg5cVFaZXFxZlhFcW9yamU5OTFCUEppSHNGeUxiamZXZ3dkWGU0dW1YbTBZd3dYcFQ3UXpiLXI0UjhlLUNiWGVnUnBSczVaN3I4QW02WXVBTzhRYVk?oc=5",
            "pub_date": "2026-04-25 07:00"
          },
          {
            "title": "半导体涨价攻入终端：手机率先调价，家电汽车亦承压",
            "url": "https://news.google.com/rss/articles/CBMijwFBVV95cUxPRzUySjF1NEZQWkFtLUZYTHFHZWhGV2tKbUd1ME1hUHR5eVQxcmxyNHNxOWdwTlRESHFWUEl3UE53YlJ1anJFOUhOMHpTd2VrSWRsSjFOTjZ4TWZ4QjZtMG9fUDZlLUhaYnBlUG5RZncwVTJqekxKYUxpakVsakZzb3hpQXEwc2ZyVDJxU2o1NA?oc=5",
            "pub_date": "2026-03-17 07:00"
          }
        ]
      },
      {
        "code": "688187",
        "name": "时代电气",
        "reason": "国内动车牵引变流系统市占率约50%，轨交装备龙头地位稳固",
        "evidence": [
          {
            "title": "时代电气(688187.SH)：公司2025年国内动车牵引变流系统市占率大约在50%左右",
            "url": "https://news.google.com/rss/articles/CBMibEFVX3lxTFBqUWtSNUVvZDd2QUplR0pwS0RpTkNvSGptVGVBSkFQS0UxcXJjeFZsYUpIY011S2xaLXRDdUppNkN0VU1oZ1lWQ3k5allKQUpCZFUzMklFaXJwTmY2UlFGcnZwTW1ET2ZHeUs4OA?oc=5",
            "pub_date": "2026-05-22 08:07"
          }
        ]
      },
      {
        "code": "000725",
        "name": "京东方A",
        "reason": "面板行业景气上行，子公司终止北交所上市申请聚焦主业，主力资金大幅净流入",
        "evidence": [
          {
            "title": "京东方A(000725.SZ)：控股子公司能源科技拟终止公开发行股票并在北京证券交易所上市申请并撤回申请文件",
            "url": "https://news.google.com/rss/articles/CBMibEFVX3lxTE5mc0xTdEszYWhZc1h6WElzazFUNXFMeWJtMlhaYVFGcWdjOC1lVTNNaVF1SFhBYmR5cnlLbmFHb2NNemZiekhlOVJtVDZJUVZsSjdOVHFxWGdLZG9xMGRSVHdTbjJvWE1KUUVHNg?oc=5",
            "pub_date": "2026-06-09 11:47"
          },